{
  "schema": "gab.product-metrics.v1",
  "updatedAt": "2026-07-21T18:00:00Z",
  "window": {
    "label": "7d",
    "from": "2026-07-14T18:00:00Z",
    "to": "2026-07-21T18:00:00Z"
  },
  "health": {
    "status": "green",
    "message": "Enriched demo envelope \u2014 replace with live /metrics.json when ready"
  },
  "productId": "btcminiscript",
  "name": "Btcminiscript",
  "kpis": [
    {
      "key": "tools_built",
      "label": "Tools",
      "value": 3,
      "format": "number",
      "priority": 1
    },
    {
      "key": "research_docs",
      "label": "Research docs",
      "value": 6,
      "format": "number",
      "priority": 2
    },
    {
      "key": "test_vectors",
      "label": "Test vectors",
      "value": 140,
      "format": "number",
      "priority": 3
    }
  ],
  "series": [
    {
      "key": "commits_monthly",
      "label": "Monthly commits",
      "unit": "commits",
      "points": []
    }
  ],
  "raw": {
    "demo": true,
    "note": "Enriched with all known metrics \u2014 ready for live data"
  }
}